{
  "created_at": "2024-01-01T00:00:00Z",
  "created_by": "user",
  "dependencies": [],
  "description": "Test description",
  "id": "hoop-ttb.1",
  "issue_type": "task",
  "priority": 0,
  "schema_version": "1.0.0",
  "status": "open",
  "title": "Test bead",
  "updated_at": "2024-01-01T00:00:00Z"
}